{
  "schema_version": "0.1",
  "provider": "openstack",
  "environment_id": "railshot-sim-openstack-20261002080234",
  "node": {
    "host": "10.250.30.13",
    "ssh_user": "ubuntu"
  },
  "workload": {
    "image": "nginx:1.28.0-alpine",
    "namespace": "railshot-sim-openstack",
    "replicas": 1,
    "container_port": 80,
    "health_path": "/",
    "sample_content": true
  },
  "exposure": {
    "type": "nodeport",
    "node_port": 30080
  },
  "runtime": {
    "timeout_seconds": 180,
    "node_ip": "10.250.30.13"
  }
}
